{
  "rules": [
    {
      "body": "\n## Rule\n\nOmnia business logic must treat host resources as provider adapters. External I/O, configuration, identity tokens, durable state, document/table/blob storage, publishing, and broadcast access must flow through `omnia_sdk` provider traits on explicit generic `provider: &P` bounds. Domain crates must not construct host clients, call raw WASI modules, open sockets or files, or hide I/O behind custom abstractions.\n\nFunction bounds should name only the provider traits the function actually calls. Handler bounds should be the union of the traits required by the handler and the helpers it invokes.\n\n## Look For\n\n- Direct client construction such as `reqwest::Client`, `mongodb::Client`, `RedisClient::connect`, `TableClient`, `BlobServiceClient`, `Producer::new`, or storage SDK clients.\n- Forbidden storage or transport crates such as `reqwest`, `redis`, `sqlx`, `diesel`, `mongodb`, `azure_storage_blobs`, `aws-sdk-s3`, or host-side `hyper`.\n- Calls to raw WASI modules or guest boundary helpers from domain crates instead of `omnia_sdk` traits.\n- Functions that perform I/O but do not accept a generic `provider: &P` argument with matching trait bounds.\n- Handler bounds missing a provider trait used by a helper, or blanket bounds that obscure which I/O the handler performs.\n- Custom wrapper clients around provider traits that make tests mock the wrapper instead of the Omnia provider adapter.\n\n## Spec Guidance\n\nWhen artifacts describe an external dependency but not its Omnia adapter, ask for the provider mapping instead of recreating the source runtime client. Prefer the closest first-party provider: `HttpRequest`, `Config`, `Identity`, `StateStore`, `TableStore`, `DocumentStore`, `Blobstore`, `Publish`, or `Broadcast`.\n",
      "deprecated": null,
      "origin": "target",
      "path": "adapters/targets/omnia/codex/provider-only-host-access.md",
      "path-root": "codex-root",
      "rule-id": "OMNIA-001",
      "severity": "critical",
      "title": "Provider-Only Host Access",
      "trigger": "An Omnia Rust crate performs external I/O, reads configuration, stores state, publishes messages, or accesses identity without going through Omnia SDK provider traits."
    },
    {
      "body": "\n## Rule\n\nOmnia crates must run as stateless `wasm32-wasip2` guest components. Production code must not rely on native process features, background threads, direct filesystem/network/environment access, mutable global state, runtime singletons, blocking I/O, or crates that require an OS-backed runtime. State that must outlive one invocation belongs in host providers, not component memory.\n\nCompile-time constants and immutable `LazyLock` lookup tables are acceptable when they do not cache request data, credentials, provider results, or runtime state.\n\n## Look For\n\n- `std::env`, `std::fs`, `std::net`, `std::process`, `std::thread::spawn`, or synchronous I/O used in production guest code.\n- Runtime dependencies such as `tokio` as an application runtime, native `hyper` servers, `rand`, `uuid` generation that depends on runtime randomness, or dotenv-style configuration loaders.\n- `static mut`, `OnceCell`, `OnceLock`, `lazy_static!`, or `Mutex<HashMap<...>>` used as caches or mutable singleton state.\n- Background task, timer, circuit-breaker, worker-pool, retry daemon, or startup-loader patterns copied from a server process.\n- Assumptions that data loaded once will remain available across handler invocations.\n- Direct use of system clocks or sleeps for scheduling instead of invocation-time logic and provider-backed state.\n\n## Spec Guidance\n\nWhen source behavior depends on process lifetime, translate the requirement into an Omnia runtime pattern. Startup caches usually become cache-aside reads through `StateStore` plus the original data provider; periodic refresh usually becomes TTL-backed cache expiry; token caches usually become `Identity` provider calls.\n",
      "deprecated": null,
      "origin": "target",
      "path": "adapters/targets/omnia/codex/wasm-guest-runtime-constraints.md",
      "path-root": "codex-root",
      "rule-id": "OMNIA-002",
      "severity": "critical",
      "title": "WASM Guest Runtime Constraints",
      "trigger": "An Omnia guest relies on process, thread, filesystem, environment, randomness, mutable global state, blocking I/O, or native runtime behavior unavailable in wasm32-wasip2."
    },
    {
      "body": "\n## Rule\n\nProduction Omnia handler paths must handle fallible operations by returning `omnia_sdk::Result` with an appropriate `omnia_sdk::Error` classification, stable code, description, and useful context. Do not use panic-based control flow outside tests.\n\nUse `bad_request!` for invalid caller input, `bad_gateway!` for upstream provider or dependency failures, `server_error!` for internal invariant failures, and domain error conversions when stable error codes matter. Add context at parse, serialization, provider, and conversion boundaries before mapping errors into the SDK model.\n\n## Look For\n\n- `unwrap()`, `expect()`, `panic!`, `todo!`, `unimplemented!`, unchecked indexing, or `unreachable!` in non-test handler paths.\n- `let _ = fallible_call(...)`, ignored `Result`s, swallowed provider errors, or fallback values that hide failed work.\n- Public handler or domain functions returning `anyhow::Error`, string errors, or custom errors that do not convert to `omnia_sdk::Error`.\n- Method-style constructors such as `Error::bad_request(...)` or `Error::not_found(...)`, which are not the Omnia SDK error API.\n- Provider failures mapped to generic internal errors when they should be dependency failures.\n- Error codes built from variable data instead of stable snake_case identifiers.\n- Generic descriptions such as \"failed\" or \"invalid input\" that omit the operation, field, or dependency involved.\n\n## Spec Guidance\n\nIf artifacts define error codes or classifications, preserve them rather than inventing a finer-grained error model. If the spec is silent, propose the smallest useful error contract: invalid input, not found, upstream dependency failure, and internal invariant failure.\n",
      "deprecated": null,
      "origin": "target",
      "path": "adapters/targets/omnia/codex/classified-errors-no-panics.md",
      "path-root": "codex-root",
      "rule-id": "RUST-001",
      "severity": "critical",
      "title": "Classified SDK Errors, No Panic Paths",
      "trigger": "Production Rust handler code can panic, discard a fallible result, or return an error that bypasses Omnia SDK classification."
    },
    {
      "body": "\n## Rule\n\nSecrets, credentials, connection strings, and access tokens must be supplied by the Omnia host and reached through approved provider traits. Source code must not contain literal secrets, read environment variables directly, construct storage authentication headers manually, derive tokens from keys, log secret values, or persist tokens in component state.\n\nAuthenticated HTTP should follow the `Config` -> `Identity::access_token` -> `HttpRequest::fetch` sequence. Storage, database, document, table, blob, and publish authentication should use the corresponding Omnia provider instead of raw signed requests or embedded credentials.\n\n## Look For\n\n- Literal API keys, bearer tokens, connection strings, passwords, private keys, SAS tokens, SharedKey credentials, or certificate material.\n- `std::env::var`, dotenv loaders, or config files used to retrieve secrets inside a guest component.\n- `Authorization` headers built from hardcoded strings, configuration values that are themselves tokens, or manually generated HMAC signatures.\n- Azure Table, blob storage, SQL, Redis, MongoDB, or message-broker access implemented with raw credentials instead of `DocumentStore`, `TableStore`, `Blobstore`, `StateStore`, `Publish`, or `Identity`.\n- `tracing`, `println!`, debug output, error descriptions, or test snapshots that include secret values or bearer tokens.\n- Tokens cached in `static`, `OnceCell`, `StateStore`, request structs, or serialized output.\n\n## Spec Guidance\n\nSpecs and designs should name the required config keys, identity names, and provider adapters, not secret values. If a source migration exposes an environment variable containing a secret, capture the dependency as host-managed configuration or identity and keep the value out of artifacts.\n",
      "deprecated": null,
      "origin": "target",
      "path": "adapters/targets/omnia/codex/host-managed-secrets-identity.md",
      "path-root": "codex-root",
      "rule-id": "SEC-001",
      "severity": "critical",
      "title": "Host-Managed Secrets and Identity",
      "trigger": "An Omnia crate embeds, derives, logs, persists, or reads credentials or tokens outside the host-managed Config and Identity provider flow."
    },
    {
      "body": "\n## Rule\n\nValidate all user-supplied or external data at the boundary before domain logic consumes it. Validation should cover text normalization, required values, numeric ranges, identifier existence, and external payload shape.\n\n## Look For\n\n- Handler entry points that accept strings from the user without trimming whitespace or rejecting empty values.\n- Numeric parameters without range or sign validation.\n- ID lookups that assume the referenced item exists, with no guard for missing targets.\n- Data received from external APIs consumed without schema or type validation.\n\n## Spec Guidance\n\nWhen the spec is silent on validation rules for a user action, propose explicit acceptance criteria such as \"title must be non-empty after trimming\" or \"quantity must be 1..999\".\n",
      "deprecated": null,
      "origin": "shared",
      "path": "adapters/shared/codex/universal/unvalidated-input.md",
      "path-root": "codex-root",
      "rule-id": "UNI-002",
      "severity": "critical",
      "title": "Unvalidated Input",